{
  "$schema": "https://json-schema.org/draft/2020-12/schema",
  "$id": "https://schemas.cumulus.sh/nimbus-db-manifest/v0.schema.json",
  "type": "object",
  "required": [
    "apiVersion",
    "kind",
    "metadata",
    "target",
    "resources"
  ],
  "properties": {
    "apiVersion": {
      "const": "nimbus.db/v0.1"
    },
    "kind": {
      "const": "DatabaseManifest"
    },
    "metadata": {
      "type": "object",
      "required": [
        "name"
      ],
      "properties": {
        "name": {
          "type": "string",
          "minLength": 1
        },
        "workspace": {
          "type": "string",
          "minLength": 1
        }
      },
      "additionalProperties": false
    },
    "target": {
      "type": "object",
      "required": [
        "engine",
        "database"
      ],
      "properties": {
        "engine": {
          "const": "postgres"
        },
        "database": {
          "type": "string",
          "minLength": 1
        },
        "environment": {
          "type": "string",
          "minLength": 1
        }
      },
      "additionalProperties": false
    },
    "resources": {
      "type": "object",
      "properties": {
        "schemas": {
          "type": "array",
          "items": {
            "type": "object",
            "required": [
              "name"
            ],
            "properties": {
              "name": {
                "type": "string",
                "minLength": 1
              }
            },
            "additionalProperties": false
          }
        },
        "tables": {
          "type": "array",
          "items": {
            "type": "object",
            "required": [
              "name",
              "columns"
            ],
            "properties": {
              "schema": {
                "type": "string",
                "minLength": 1,
                "default": "public"
              },
              "name": {
                "type": "string",
                "minLength": 1
              },
              "renameFrom": {
                "anyOf": [
                  {
                    "type": "string",
                    "minLength": 1
                  },
                  {
                    "type": "object",
                    "required": [
                      "name"
                    ],
                    "properties": {
                      "schema": {
                        "type": "string",
                        "minLength": 1
                      },
                      "name": {
                        "type": "string",
                        "minLength": 1
                      }
                    },
                    "additionalProperties": false
                  }
                ]
              },
              "columns": {
                "type": "array",
                "minItems": 1,
                "items": {
                  "type": "object",
                  "required": [
                    "name",
                    "type"
                  ],
                  "properties": {
                    "name": {
                      "type": "string",
                      "minLength": 1
                    },
                    "renameFrom": {
                      "type": "string",
                      "minLength": 1
                    },
                    "type": {
                      "type": "string",
                      "minLength": 1
                    },
                    "nullable": {
                      "type": "boolean"
                    },
                    "primaryKey": {
                      "type": "boolean"
                    },
                    "unique": {
                      "type": "boolean"
                    },
                    "default": {
                      "type": "string"
                    }
                  },
                  "additionalProperties": false
                }
              },
              "indexes": {
                "type": "array",
                "items": {
                  "type": "object",
                  "required": [
                    "columns"
                  ],
                  "properties": {
                    "name": {
                      "type": "string",
                      "minLength": 1
                    },
                    "columns": {
                      "type": "array",
                      "minItems": 1,
                      "items": {
                        "type": "string",
                        "minLength": 1
                      }
                    },
                    "unique": {
                      "type": "boolean"
                    }
                  },
                  "additionalProperties": false
                }
              }
            },
            "additionalProperties": false
          }
        },
        "rawSql": {
          "type": "array",
          "items": {
            "type": "string",
            "minLength": 1
          }
        }
      },
      "additionalProperties": false
    },
    "policies": {
      "type": "object",
      "properties": {
        "destructiveChanges": {
          "enum": [
            "block",
            "require_approval"
          ]
        },
        "snapshotBefore": {
          "type": "array",
          "items": {
            "enum": [
              "destructive",
              "irreversible",
              "high"
            ]
          }
        }
      },
      "additionalProperties": false
    }
  },
  "additionalProperties": false
}
